path,releaseAssetName,role,includeInDoiDeposit,checksumStatus,bytes,sha256,archiveNote
dist/lobby-capture-wiley-submission.zip,lobby-capture-wiley-submission.zip,wiley-submission-archive,yes,release-asset-checksum-recorded-in-dist,see-dist-release-asset-checksums,see-dist-release-asset-checksums,"Primary journal submission archive with manuscript source, compiled PDFs, supporting information, generated reports, and package-member checksum manifest."
paper/regulation-governance-wiley.pdf,regulation-governance-wiley.pdf,wiley-rendered-manuscript,yes,release-asset-checksum-recorded-in-dist,see-dist-release-asset-checksums,see-dist-release-asset-checksums,Wiley-template rendered manuscript PDF for review.
paper/strategic-channel-substitution-regulatory-capture.pdf,strategic-channel-substitution-regulatory-capture.pdf,local-rendered-manuscript,yes,release-asset-checksum-recorded-in-dist,see-dist-release-asset-checksums,see-dist-release-asset-checksums,Local rendered manuscript PDF with the descriptive project filename.
paper/supplement.pdf,supplement.pdf,supporting-information-pdf,yes,release-asset-checksum-recorded-in-dist,see-dist-release-asset-checksums,see-dist-release-asset-checksums,Rendered supporting-information PDF.
CITATION.cff,,citation-metadata,source-archive,tracked-source-verified,1286,214e623b272250d07ed33436da0d6a40f0c93460354d70a1c279b65b3d057e24,Machine-readable citation metadata included in the tagged source archive and Wiley submission archive.
.zenodo.json,,doi-deposit-metadata,source-archive,tracked-source-verified,1490,896f3932b6736e88dbafc422837a6296dce9bc8ae24e8a09c5550e8dec78fcc5,Zenodo-compatible metadata included in the tagged source archive and Wiley submission archive.
reports/submission-readiness.md,,submission-readiness-audit,source-archive,tracked-source-verified,4469,819bb5dd3b4062de63ccae3def1403ee706de16cc9a69067600848887ded4009,Generated gate summary distinguishing mechanism-review readiness from DOI and human signoff.
reports/final-human-readthrough.md,,manual-signoff-record,source-archive,tracked-source-verified,2930,5ef7d2bd86fcca70f9b8270a222b6e2f0a2bcb0d9d606441e0ca6ef1f0e092e0,Manual final-submission read-through checklist; remains pending until signed for the release.
