path,releaseAssetName,role,includeInDoiDeposit,checksumStatus,bytes,sha256,archiveNote
dist/lobby-capture-wiley-submission.zip,lobby-capture-wiley-submission.zip,wiley-submission-archive,yes,release-asset-checksum-recorded-in-dist,see-dist-release-asset-checksums,see-dist-release-asset-checksums,"Primary journal submission archive with manuscript source, compiled PDFs, supporting information, generated reports, and package-member checksum manifest."
paper/regulation-governance-wiley.pdf,regulation-governance-wiley.pdf,wiley-rendered-manuscript,yes,release-asset-checksum-recorded-in-dist,see-dist-release-asset-checksums,see-dist-release-asset-checksums,Wiley-template rendered manuscript PDF for review.
paper/strategic-channel-substitution-regulatory-capture.pdf,strategic-channel-substitution-regulatory-capture.pdf,local-rendered-manuscript,yes,release-asset-checksum-recorded-in-dist,see-dist-release-asset-checksums,see-dist-release-asset-checksums,Local rendered manuscript PDF with the descriptive project filename.
paper/supplement.pdf,supplement.pdf,supporting-information-pdf,yes,release-asset-checksum-recorded-in-dist,see-dist-release-asset-checksums,see-dist-release-asset-checksums,Rendered supporting-information PDF.
CITATION.cff,,citation-metadata,source-archive,tracked-source-verified,1286,07cac1e4109e8d8b0ec964520c1a2a2dc1ce021b23223bc93b11da14d244378a,Machine-readable citation metadata included in the tagged source archive and Wiley submission archive.
.zenodo.json,,doi-deposit-metadata,source-archive,tracked-source-verified,1490,f88f34e8c274f0813c01c0177cfb8df6edf0c32975cccc97040d0440ee5d081c,Zenodo-compatible metadata included in the tagged source archive and Wiley submission archive.
reports/submission-readiness.md,,submission-readiness-audit,source-archive,tracked-source-verified,5028,b24d666a66593958858fd7678c323f88fcc028803d3bae422acf442e3a8e0027,Generated gate summary distinguishing mechanism-review readiness from DOI and human signoff.
reports/final-human-readthrough.md,,manual-signoff-record,source-archive,tracked-source-verified,5292,59dd3fcf453288975616d7ac246bb644b7c765f17d332ca204e00f74787c7787,Manual final-submission read-through checklist; remains pending until signed for the release.
