path,releaseAssetName,role,includeInDoiDeposit,checksumStatus,bytes,sha256,archiveNote
dist/lobby-capture-wiley-submission.zip,lobby-capture-wiley-submission.zip,wiley-submission-archive,yes,release-asset-checksum-recorded-in-dist,see-dist-release-asset-checksums,see-dist-release-asset-checksums,"Primary journal submission archive with manuscript source, compiled PDFs, supporting information, generated reports, and package-member checksum manifest."
paper/regulation-governance-wiley.pdf,regulation-governance-wiley.pdf,wiley-rendered-manuscript,yes,release-asset-checksum-recorded-in-dist,see-dist-release-asset-checksums,see-dist-release-asset-checksums,Wiley-template rendered manuscript PDF for review.
paper/strategic-channel-substitution-regulatory-capture.pdf,strategic-channel-substitution-regulatory-capture.pdf,local-rendered-manuscript,yes,release-asset-checksum-recorded-in-dist,see-dist-release-asset-checksums,see-dist-release-asset-checksums,Local rendered manuscript PDF with the descriptive project filename.
paper/supplement.pdf,supplement.pdf,supporting-information-pdf,yes,release-asset-checksum-recorded-in-dist,see-dist-release-asset-checksums,see-dist-release-asset-checksums,Rendered supporting-information PDF.
CITATION.cff,,citation-metadata,source-archive,tracked-source-verified,1286,f15fdf97dd67617e11a3d47520cd6f6d500046de4212171ca9b0a7319c502431,Machine-readable citation metadata included in the tagged source archive and Wiley submission archive.
.zenodo.json,,doi-deposit-metadata,source-archive,tracked-source-verified,1490,04f652c3f41c3c9093318c22b75486fc1e764cdd0e8a7d7c87fa34055292897f,Zenodo-compatible metadata included in the tagged source archive and Wiley submission archive.
reports/submission-readiness.md,,submission-readiness-audit,source-archive,tracked-source-verified,4939,093392a9976e3430381f43f21d6a1ab7de3c3cbce6f2879e4a7968286a2c0813,Generated gate summary distinguishing mechanism-review readiness from DOI and human signoff.
reports/final-human-readthrough.md,,manual-signoff-record,source-archive,tracked-source-verified,5254,dafe54ab90895fa252c8d06ad019788fd41df26711d01c507a9b3680ae88cb95,Manual final-submission read-through checklist; remains pending until signed for the release.
