path,releaseAssetName,role,includeInDoiDeposit,checksumStatus,bytes,sha256,archiveNote
dist/lobby-capture-wiley-submission.zip,lobby-capture-wiley-submission.zip,wiley-submission-archive,yes,release-asset-checksum-recorded-in-dist,see-dist-release-asset-checksums,see-dist-release-asset-checksums,"Primary journal submission archive with manuscript source, compiled PDFs, supporting information, generated reports, and package-member checksum manifest."
paper/regulation-governance-wiley.pdf,regulation-governance-wiley.pdf,wiley-rendered-manuscript,yes,release-asset-checksum-recorded-in-dist,see-dist-release-asset-checksums,see-dist-release-asset-checksums,Wiley-template rendered manuscript PDF for review.
paper/strategic-channel-substitution-regulatory-capture.pdf,strategic-channel-substitution-regulatory-capture.pdf,local-rendered-manuscript,yes,release-asset-checksum-recorded-in-dist,see-dist-release-asset-checksums,see-dist-release-asset-checksums,Local rendered manuscript PDF with the descriptive project filename.
paper/supplement.pdf,supplement.pdf,supporting-information-pdf,yes,release-asset-checksum-recorded-in-dist,see-dist-release-asset-checksums,see-dist-release-asset-checksums,Rendered supporting-information PDF.
CITATION.cff,,citation-metadata,source-archive,tracked-source-verified,1286,8132c0b7a581518a4a11af4654ac03b2e7d74937c91bbc0828f9cdd0621031bb,Machine-readable citation metadata included in the tagged source archive and Wiley submission archive.
.zenodo.json,,doi-deposit-metadata,source-archive,tracked-source-verified,1490,88ae2660dc87d162cffc5c021330cd6d5c96e835c184b421ce14598065c60558,Zenodo-compatible metadata included in the tagged source archive and Wiley submission archive.
reports/submission-readiness.md,,submission-readiness-audit,source-archive,tracked-source-verified,5167,50a7c60bace01dda09a411474b20fa1116fff1ed1441d0783519ba9f6521b7a4,Generated gate summary distinguishing mechanism-review readiness from DOI and human signoff.
reports/final-human-readthrough.md,,manual-signoff-record,source-archive,tracked-source-verified,4638,363387d3aa25c3b71f1522ac38bebfbee187b04868e6dceb8f6d9b941cf268c2,Manual final-submission read-through checklist; remains pending until signed for the release.
