path,releaseAssetName,role,includeInDoiDeposit,checksumStatus,bytes,sha256,archiveNote
dist/lobby-capture-wiley-submission.zip,lobby-capture-wiley-submission.zip,wiley-submission-archive,yes,release-asset-checksum-recorded-in-dist,see-dist-release-asset-checksums,see-dist-release-asset-checksums,"Primary journal submission archive with manuscript source, compiled PDFs, supporting information, generated reports, and package-member checksum manifest."
paper/regulation-governance-wiley.pdf,regulation-governance-wiley.pdf,wiley-rendered-manuscript,yes,release-asset-checksum-recorded-in-dist,see-dist-release-asset-checksums,see-dist-release-asset-checksums,Wiley-template rendered manuscript PDF for review.
paper/strategic-channel-substitution-regulatory-capture.pdf,strategic-channel-substitution-regulatory-capture.pdf,local-rendered-manuscript,yes,release-asset-checksum-recorded-in-dist,see-dist-release-asset-checksums,see-dist-release-asset-checksums,Local rendered manuscript PDF with the descriptive project filename.
paper/supplement.pdf,supplement.pdf,supporting-information-pdf,yes,release-asset-checksum-recorded-in-dist,see-dist-release-asset-checksums,see-dist-release-asset-checksums,Rendered supporting-information PDF.
CITATION.cff,,citation-metadata,source-archive,tracked-source-verified,1286,18ba123014cd51a1b4e4fb4f0ea3217b80937cdee0415ddd24ef9bba23959b30,Machine-readable citation metadata included in the tagged source archive and Wiley submission archive.
.zenodo.json,,doi-deposit-metadata,source-archive,tracked-source-verified,1490,52d78e1317882e189b7b5ebc4da9e3ca8039494738f1a78b429b00ecfe946e29,Zenodo-compatible metadata included in the tagged source archive and Wiley submission archive.
reports/submission-readiness.md,,submission-readiness-audit,source-archive,tracked-source-verified,5183,53ff492b0f7056b7e9305f0f5c8abb93a87f9bce11d57ab59386f98acaa2a6f2,Generated gate summary distinguishing mechanism-review readiness from DOI and human signoff.
reports/final-human-readthrough.md,,manual-signoff-record,source-archive,tracked-source-verified,4767,566dd98c1c9912346618bdf812e9c240b684c115d721f460691100a724de7e28,Manual final-submission read-through checklist; remains pending until signed for the release.
