productKey,expectedPath,sourceProductStatus,requirementLevel,priority,minimumRows,preferredOfficialSource,officialSourceUrl,fallbackSource,requiredLinkage,acquisitionStep,promotionGate,claimBoundary,currentBlocker
sam-fpds-action-history-crosswalk,data/calibration/first-wave/sam-fpds-action-history-crosswalk.csv,candidate_unreviewed,required,P1,5000,"SAM.gov Contract Awards export or keyed Contract Awards API, reconciled against USAspending transaction rows",https://open.gsa.gov/api/contract-awards/,USAspending public transaction download strata already documented by the repository; use only as a bounded denominator until SAM/FPDS-style action coding is reconciled,"PIID, UEI, awarding agency/subtier, recipient, action date, obligation, modification number/type, competition or extent-competed code, number of offers, USAspending record ID, SAM record ID, and crosswalk confidence","After SAM quota reset, request a representative Contract Awards export, record the emailed link with make sam-contract-awards-record-export-link, then run make sam-procurement-refresh.","Export audit must report promotion-readiness=candidate; then make first-wave-source-products, make first-wave-source-readiness, and make paper-artifacts-check must pass.",A SAM/FPDS action-history crosswalk can improve procurement denominator validity; it does not by itself estimate capture effects without exposure timing and comparison design.,SAM.gov quota or extract-token availability can block acquisition; partial or diagnostic exports must not be promoted.
gao-protest-overlay,data/calibration/first-wave/gao-protest-overlay.csv,candidate_unreviewed,required,P1,25,"GAO Recent Bid Protest Decisions, GAO Search Decisions & Docket, and GAO Legal Products XML feed",https://www.gao.gov/legal/bid-protests/recent; https://www.gao.gov/rss/reportslegal.xml,"Run make gao-protest-feed-preflight against the GAO Legal Products XML feed for discovery; the ignored worklist extracts B-numbers, decision dates, protester names, agency hints, awardee hints, coarse issue-code hints, and visible outcome language before source-page review","Protest ID or B-number, agency, filed date where available, decision date, outcome, issue codes, source URL, and manually reviewed PIID/UEI/vendor linkage when available","Run make gao-protest-feed-preflight to build an ignored GAO protest discovery worklist, review the high-priority rows against official decision pages or PDFs, then manually link decisions to PIID, UEI or vendor, agency, outcome, and issue fields before promotion.",Each row needs a source URL plus PIID or vendor linkage; unmatched protests remain context rows and cannot clear the product gate.,GAO protest rows measure observed dispute outcomes; this source does not identify lobbying exposure or capture without linked award/action and actor records.,"The GAO feed can discover recent bid-protest decisions and hints, but decision pages do not reliably expose PIID/UEI fields in a machine-readable way, so award/vendor linkage and outcome/issue coding remain manual review tasks."
sam-exclusion-overlay,data/calibration/first-wave/sam-exclusion-overlay.csv,candidate_unreviewed,required,P1,25,SAM.gov Exclusions API and SAM.gov Entity/Exclusions Extracts Download API,https://open.gsa.gov/api/exclusions-api/,Run make sam-exclusions-preflight for a redacted quota/access check; use SAM_Exclusions_Public_Extract files from the official Entity/Exclusions Extracts API when a broad public extract is preferable,"Exclusion ID, UEI, recipient/entity name, exclusion type, activation/start date, termination/end date, excluding agency, and source URL","Run make sam-exclusions-preflight before source acquisition, then use the Exclusions API for targeted UEI/entity checks or the public exclusion extract for a broader panel; keep API keys in .env and archive only normalized public rows.","Rows must carry UEI linkage, timing, exclusion type, and source provenance; active-only or missing-date rows cannot clear the causal source gate.",Exclusions separate integrity-enforcement status from procurement outcomes; they are not proof of capture or corruption.,"Official API quota and extract access must be managed; the preflight records access state only, and broad extracts still require field normalization and source-date preservation."
procurement-firewall-overlay,data/calibration/first-wave/procurement-firewall-overlay.csv,candidate_unreviewed,required,P1,1,"Agency procurement-integrity rules, firewall memoranda, acquisition-policy supplements, inspector-general reports, and official policy archives",https://www.acquisition.gov/far/,Agency acquisition-policy pages and inspector-general/audit reports with source URLs and effective dates,"Firewall rule ID, agency, subtier, award type, effective date, covered officials, control type, coverage rule, and source URL","Start with the agencies represented in the action-history crosswalk, then encode dated procurement-integrity controls and coverage rules for the relevant award classes.",At least one dated control rule with agency and covered-official fields is required; generic policy descriptions without dates stay as notes.,Firewall rows represent observed institutional controls; they do not establish compliance or enforcement without audit or outcome linkage.,"No single public API provides agency firewall controls, so acquisition is a curated document-review task over official sources."
procurement-offer-competition-enrichment,data/calibration/first-wave/procurement-offer-competition-enrichment.csv,candidate_unreviewed,required,P1,5000,SAM.gov Contract Awards and USAspending transaction/action records where offer-count and competition fields are exposed,https://open.gsa.gov/api/,"Award-detail and latest-transaction fields from USAspending, retained as directional context when action-history fields are absent","PIID, UEI, agency, action date, award type, extent-competed code, number of offers, source system, source-system record ID, source URL, and crosswalk confidence","Populate the standalone offer/competition enrichment product from SAM/FPDS or USAspending rows with observed source competition fields, then reconcile it with the action-history crosswalk.","The source-product gate requires at least 5,000 rows, at least 1,000 distinct PIIDs, at least six agencies, at least two competition codes, nonempty source provenance, and high offer-count coverage.",Competition enrichment supports controls and stratification; it is not an independent capture outcome.,No reviewed standalone offer/competition source product has been promoted yet; committed USAspending action rows remain denominator context until source-system competition fields clear the gate.
