source,snapshotStatus,role,rows,agencyCount,recipientCount,knownPiidShare,knownUeiShare,actionDateShare,knownCompetitionShare,dateFrom,dateTo,dateSpanDays,dateSpanDisplay,initialActionShare,modifiedActionShare,distinctAwardCount,modifiedAwardCount,modifiedAwardShare,modificationRowsPerModifiedAward,amountWeightedModificationShare,topAgencyAmountShare,topAgencyRowShare,topAgencyAmountRowGap,topRecipientAmountShare,topRecipientRowShare,promotionReadiness,claimBoundary,statusNote
usaspending-procurement-actions,ok,primary action denominator,28104,12,8286,1.0000,1.0000,1.0000,0.0000,2023-10-01,2024-09-30,365,365d,0.5778,0.4222,23809,8201,0.3444,1.4469,0.6344,0.4609,0.0854,0.3755,0.0812,0.0145,not-applicable,bounded transaction/action diagnostics; not representative SAM/FPDS calibration,normalized USAspending procurement action rows written after SAM fallback
usaspending-procurement-national-actions,ok,national-volume concentration denominator,1500,17,469,1.0000,1.0000,1.0000,0.0000,2023-10-01,2024-09-30,365,365d,0.7453,0.2547,1343,250,0.1862,1.5280,0.5907,0.5889,0.7153,-0.1264,0.1139,0.0473,not-applicable,national USAspending action concentration diagnostic; not a modification-incidence denominator,normalized national-volume USAspending procurement action rows written; agencyFilter=ALL; periodBuckets=annual; pageSize=100; maxPages=5; sortSpecs=Transaction Amount:desc;Mod:asc;Action Date:asc
usaspending-procurement-bulk-summary,copied,archived public transaction-history summary,6449101,12,90798,1.0000,1.0000,1.0000,0.9983,2023-10-01,2024-09-30,365,365d,0.8298,0.1702,5740062,612402,0.1067,1.7920,0.5955,0.6264,0.6854,-0.0590,0.0552,0.0766,candidate,representative public USAspending transaction summary for configured agencies; raw CSV/ZIP archive required for full reproduction,78322c3babe1a2b69ed2cc88a1c306f3344e97de96e2d8a81f8c4f4277dcee5b
sam-contract-awards,unavailable,optional SAM/FPDS-style action route,0,0,0,0.0000,0.0000,0.0000,0.0000,,,0,0d,0.0000,0.0000,0,0,0.0000,0.0000,0.0000,0.0000,0.0000,0.0000,0.0000,0.0000,blocked,stronger source route only if active rows are archived in the frozen snapshot,SAM.gov Contract Awards request failed; mode=1; format=json; filterCount=12; pageSize=100; maxPages=1; offsetPageStarts=0+10+50; fallback=USAspending action rows
usaspending-procurement-bridge,ok,multi-agency top-award bridge,150,6,106,1.0000,1.0000,1.0000,1.0000,1978-09-30,2024-09-30,16802,n/a,0.0000,1.0000,149,149,1.0000,1.0067,1.0000,0.5115,0.1667,0.3448,0.1191,0.0333,not-applicable,concentration and competition diagnostic; not an action-history denominator,normalized multi-agency procurement bridge rows written
usaspending-awards,ok,EPA award-level surface,200,1,100,1.0000,1.0000,1.0000,1.0000,2000-06-15,2024-09-30,8873,n/a,1.0000,0.0000,198,0,0.0000,0.0000,0.0000,1.0000,1.0000,0.0000,0.0668,0.0800,not-applicable,award identifier and competition surface; not an action-history denominator,normalized EPA award rows written
