panel,mechanism,evidenceClass,metric,value,fixtureValue,fixtureSupported,status,note,nextAction
Direct dark money,Opaque donor routing and hidden electoral influence,proxy/thin,darkMoneySourceShare,0.0249,0.0905,yes,thin,coverage is present but thin for article-level calibration,Add explicit electioneering/curated dark-money rows where available; use IRS 501(c)(4)/(c)(6) rows only as opaque-capacity proxies and keep Schedule E super PAC rows separate.
Outside spending,Independent expenditure pressure outside candidate finance,direct,outsideSpendingRows,650.0000,2.0000,no,usable,"coverage is usable for mechanism diagnostics, subject to source-scope limits","Broaden OpenFEC Schedule E, electioneering communication, independent expenditure, and spender/payee coverage."
Public financing,Countervailing campaign finance and voucher/matching funds,direct when present,publicFinancingSourceShare,0.0830,0.4269,yes,thin,coverage is present but thin for article-level calibration,"Add NYC matching-fund, Seattle voucher, and federal public-financing panels as direct program rows."
Intermediaries,"Association, nonprofit, think-tank, and campaign-intermediary capacity",proxy,intermediaryRows,853.0000,6.0000,yes,usable,"coverage is usable for mechanism diagnostics, subject to source-scope limits","Expand NYC CFB intermediary and IRS EO BMF rows with IRS 8871/8872, Form 990 XML, association, think-tank, and grantmaking exports."
Revolving door,"Post-government access, covered-position links, and cooling-off exposure",proxy/thin,revolvingDoorRows,284.0000,14.0000,no,thin,coverage is present but thin for article-level calibration,"Supplement LDA covered-position rows with OGE, FACA, witness, LegiStorm/OpenSecrets, or archived personnel movement exports."
Procurement identifiers,Vendor and award-path matching for procurement influence,direct identifier coverage,procurementKnownPiidShare,1.0000,1.0000,yes,usable,"coverage is usable for mechanism diagnostics, subject to source-scope limits","Broaden SAM/FPDS and USAspending enrichment with PIID, UEI, action-date, modification, competition, exclusion, and protest fields."
Procurement concentration bridge,Multi-agency vendor and agency concentration diagnostics,direct top-award bridge,procurementBridgeAgencyCount,6.0000,0.0000,no,thin,"multi-agency top-award bridge is present, but top-award sampling is not representative enough for calibration",Replace the top-award bridge with representative SAM/FPDS action-level extracts before treating agency concentration as calibrated.
Procurement modification risk,Post-award modification and specification-change pressure,proxy/thin,procurementExPostModificationShare,0.0000,0.6000,yes,warning,latest-transaction modification enrichment is available but kept separate from action-level incidence; representative transaction denominators are still absent,Separate initial awards from post-award modifications and validate nonzero modification numbers against FPDS transactions.
