gate,status,evidence,nextAction
metadata-json,ready,title=present; creators=1; version=paper-publication-readiness-2026-06-18-r174; expected=paper-publication-readiness-2026-06-18-r174; license=mit-license,Keep .zenodo.json and CITATION.cff synchronized before DOI deposit.
api-target,ready,apiBase=https://sandbox.zenodo.org/api; docs=https://developers.zenodo.org/,Use sandbox for rehearsal; switch to https://zenodo.org/api only for the final DOI draft.
token,manual_required,tokenVariable=missing; token=missing,"Set ZENODO_ACCESS_TOKEN, ZENODO_API_TOKEN, ZENODO_TOKEN, or the target-specific sandbox/production token in .env before creating an unpublished draft."
doi-package,ready,package=present; checksum=ok; byte-level record=dist/doi-deposit-package-checksum.*,Run make doi-deposit-package before a Zenodo upload.
archive-manifest,ready,releaseTag=paper-publication-readiness-2026-06-18-r174; expected=paper-publication-readiness-2026-06-18-r174,Regenerate the archive handoff manifest before a DOI upload.
claim-boundary,ready,overall=ready_for_mechanism_review; policy-language=ready,Keep the Zenodo description bounded to mechanism-model review until calibrated policy gates clear.
doi-record,manual_required,DOI=not recorded yet,"After Zenodo reserves or mints a DOI, record it in CITATION.cff, .zenodo.json, the paper declarations, and final-human-readthrough.md."
human-readthrough,manual_required,final-human-readthrough status=pending,Do not publish the Zenodo record as the final journal submission archive until the human read-through is signed off.
